TITRE,NBR EPISODE, NBR SEASON,RATING,DIRECTOR,REVIEW,STREAMING LINK,DESCRIPTION
Solo Leveling,Chugong,14,1,4,Dans un monde dans lequel les chasseurs - des guerriers humains dotés de capacités surnaturelles - doivent combattre des monstres mortels pour protéger l'humanité d'une annihilation certaine, un chasseur notoirement faible nommé Sung Jinwoo se retrouve dans une lutte apparemment sans fin pour sa survie. Un jour, après avoir survécu de justesse à un double donjon extrêmement puissant qui a failli anéantir tout son groupe, un mystérieux programme appelé le Système le choisit comme unique joueur et lui donne la compétence extrêmement rare de monter en puissance et de transformer tous ceux qu'il tue en un fidèle serviteur appelé une ombre. Jinwoo se lance alors dans un périple où il affronte toutes sortes d'ennemis, hommes et monstres, pour découvrir les secrets des donjons et la véritable source de ses pouvoirs.Dans un monde dans lequel les chasseurs - des guerriers humains dotés de capacités surnaturelles - doivent combattre des monstres mortels pour protéger l'humanité d'une annihilation certaine, un chasseur notoirement faible nommé Sung Jinwoo se retrouve dans une lutte apparemment sans fin pour sa survie. Un jour, après avoir survécu de justesse à un double donjon extrêmement puissant qui a failli anéantir tout son groupe, un mystérieux programme appelé le Système le choisit comme unique joueur et lui donne la compétence extrêmement rare de monter en puissance et de transformer tous ceux qu'il tue en un fidèle serviteur appelé une ombre. Jinwoo se lance alors dans un périple où il affronte toutes sortes d'ennemis, hommes et monstres, pour découvrir les secrets des donjons et la véritable source de ses pouvoirs.,netflix.com/sololvl,vraiment pas mal
South Park,Trey Parker/Matt Stone,26,1,325,Ce dessin animé pour adultes suit les aventures décalées de Cartman, Stan, Kyle et Kenny, quatre écoliers au langage fleuri, habitant la petite ville de South Park, dans le ColoradoCe dessin animé pour adultes suit les aventures décalées de Cartman, Stan, Kyle et Kenny, quatre écoliers au langage fleuri, habitant la petite ville de South Park, dans le Colorado,netflix.com/SthPrk,incroyable
SpyXFamily,Tatsuya Endō,11,1,4.7,C'est la guerre froide entre l'est et l'ouest,et une paix précaire a été établie entre les nations d'Ostania (東国オスタニア,Osutania?) 1 et Westalis (西国ウェスタリス
Made In Abyss,Akihito Tsukushi,21,2,5,’histoire se concentre autour d’une orpheline nommée Rico,vivant dans la ville de Orse,située dans la mer de Béoruska. La cité entoure un étrange et immense gouffre
SNK,Hajime Isayama,32,4,5,Plus de cent ans avant le début de l’histoire,des créatures géantes humanoïdes mangeuses d'hommes nommées Titans (巨人,Kyojin?) sont subitement apparues et ont presque anéanti l’humanité. Ces créatures géantes font habituellement entre trois et quinze mètres de haut
